{
  "schema_version": 1,
  "schedule_path": "/Users/darkbit1001/workspace/waveplan-mcp/docs/plans/2026-05-15-raft-cli-split-execution-schedule.json",
  "cursor": 10,
  "last_event": {
    "event_id": "E0011",
    "step_id": "S3_T1.3_review",
    "seq": 10,
    "task_id": "T1.3",
    "action": "review",
    "attempt": 1,
    "started_on": "2026-05-15T18:51:32Z",
    "completed_on": "2026-05-15T18:54:17Z",
    "outcome": "applied",
    "state_before": {
      "task_status": "taken"
    },
    "state_after": {
      "task_status": "review_taken"
    },
    "stdout_path": "/Users/darkbit1001/workspace/waveplan-mcp/docs/impl/raft-cli-split/logs/S3_T1.3_review.1.stdout.log",
    "stderr_path": "/Users/darkbit1001/workspace/waveplan-mcp/docs/impl/raft-cli-split/logs/S3_T1.3_review.1.stderr.log"
  },
  "events": [
    {
      "event_id": "E0001",
      "step_id": "S1_T1.1_implement",
      "seq": 1,
      "task_id": "T1.1",
      "action": "implement",
      "attempt": 1,
      "started_on": "2026-05-15T11:42:51Z",
      "completed_on": "2026-05-15T11:49:04Z",
      "outcome": "applied",
      "state_before": {
        "task_status": "available"
      },
      "state_after": {
        "task_status": "taken"
      },
      "stdout_path": "/Users/darkbit1001/workspace/waveplan-mcp/docs/impl/raft-cli-split/logs/S1_T1.1_implement.1.stdout.log",
      "stderr_path": "/Users/darkbit1001/workspace/waveplan-mcp/docs/impl/raft-cli-split/logs/S1_T1.1_implement.1.stderr.log"
    },
    {
      "event_id": "E0002",
      "step_id": "S1_T1.1_review",
      "seq": 2,
      "task_id": "T1.1",
      "action": "review",
      "attempt": 1,
      "started_on": "2026-05-15T11:49:04Z",
      "completed_on": "2026-05-15T12:24:10Z",
      "outcome": "applied",
      "state_before": {
        "task_status": "taken"
      },
      "state_after": {
        "task_status": "review_taken"
      },
      "stdout_path": "/Users/darkbit1001/workspace/waveplan-mcp/docs/impl/raft-cli-split/logs/S1_T1.1_review.1.stdout.log",
      "stderr_path": "/Users/darkbit1001/workspace/waveplan-mcp/docs/impl/raft-cli-split/logs/S1_T1.1_review.1.stderr.log"
    },
    {
      "event_id": "E0003",
      "step_id": "S1_T1.1_end_review",
      "seq": 3,
      "task_id": "T1.1",
      "action": "end_review",
      "attempt": 1,
      "started_on": "2026-05-15T12:24:10Z",
      "completed_on": "2026-05-15T12:24:10Z",
      "outcome": "failed",
      "state_before": {
        "task_status": "review_taken"
      },
      "state_after": {
        "task_status": "review_taken"
      },
      "exit_code": 2,
      "stdout_path": "/Users/darkbit1001/workspace/waveplan-mcp/docs/impl/raft-cli-split/logs/S1_T1.1_end_review.1.stdout.log",
      "stderr_path": "/Users/darkbit1001/workspace/waveplan-mcp/docs/impl/raft-cli-split/logs/S1_T1.1_end_review.1.stderr.log",
      "reason": "exit status 2"
    },
    {
      "event_id": "E0004",
      "step_id": "S1_T1.1_end_review",
      "seq": 3,
      "task_id": "T1.1",
      "action": "end_review",
      "attempt": 2,
      "started_on": "2026-05-15T18:31:44Z",
      "completed_on": "2026-05-15T18:31:47Z",
      "outcome": "applied",
      "state_before": {
        "task_status": "review_taken"
      },
      "state_after": {
        "task_status": "review_ended"
      },
      "stdout_path": "/Users/darkbit1001/workspace/waveplan-mcp/docs/impl/raft-cli-split/logs/S1_T1.1_end_review.2.stdout.log",
      "stderr_path": "/Users/darkbit1001/workspace/waveplan-mcp/docs/impl/raft-cli-split/logs/S1_T1.1_end_review.2.stderr.log"
    },
    {
      "event_id": "E0005",
      "step_id": "S1_T1.1_finish",
      "seq": 4,
      "task_id": "T1.1",
      "action": "finish",
      "attempt": 1,
      "started_on": "2026-05-15T18:31:47Z",
      "completed_on": "2026-05-15T18:31:50Z",
      "outcome": "applied",
      "state_before": {
        "task_status": "review_ended"
      },
      "state_after": {
        "task_status": "completed"
      },
      "stdout_path": "/Users/darkbit1001/workspace/waveplan-mcp/docs/impl/raft-cli-split/logs/S1_T1.1_finish.1.stdout.log",
      "stderr_path": "/Users/darkbit1001/workspace/waveplan-mcp/docs/impl/raft-cli-split/logs/S1_T1.1_finish.1.stderr.log"
    },
    {
      "event_id": "E0006",
      "step_id": "S2_T1.2_implement",
      "seq": 5,
      "task_id": "T1.2",
      "action": "implement",
      "attempt": 1,
      "started_on": "2026-05-15T18:31:50Z",
      "completed_on": "2026-05-15T18:38:47Z",
      "outcome": "applied",
      "state_before": {
        "task_status": "available"
      },
      "state_after": {
        "task_status": "taken"
      },
      "stdout_path": "/Users/darkbit1001/workspace/waveplan-mcp/docs/impl/raft-cli-split/logs/S2_T1.2_implement.1.stdout.log",
      "stderr_path": "/Users/darkbit1001/workspace/waveplan-mcp/docs/impl/raft-cli-split/logs/S2_T1.2_implement.1.stderr.log"
    },
    {
      "event_id": "E0007",
      "step_id": "S2_T1.2_review",
      "seq": 6,
      "task_id": "T1.2",
      "action": "review",
      "attempt": 1,
      "started_on": "2026-05-15T18:38:47Z",
      "completed_on": "2026-05-15T18:42:18Z",
      "outcome": "applied",
      "state_before": {
        "task_status": "taken"
      },
      "state_after": {
        "task_status": "review_taken"
      },
      "stdout_path": "/Users/darkbit1001/workspace/waveplan-mcp/docs/impl/raft-cli-split/logs/S2_T1.2_review.1.stdout.log",
      "stderr_path": "/Users/darkbit1001/workspace/waveplan-mcp/docs/impl/raft-cli-split/logs/S2_T1.2_review.1.stderr.log"
    },
    {
      "event_id": "E0008",
      "step_id": "S2_T1.2_end_review",
      "seq": 7,
      "task_id": "T1.2",
      "action": "end_review",
      "attempt": 1,
      "started_on": "2026-05-15T18:42:18Z",
      "completed_on": "2026-05-15T18:42:21Z",
      "outcome": "applied",
      "state_before": {
        "task_status": "review_taken"
      },
      "state_after": {
        "task_status": "review_ended"
      },
      "stdout_path": "/Users/darkbit1001/workspace/waveplan-mcp/docs/impl/raft-cli-split/logs/S2_T1.2_end_review.1.stdout.log",
      "stderr_path": "/Users/darkbit1001/workspace/waveplan-mcp/docs/impl/raft-cli-split/logs/S2_T1.2_end_review.1.stderr.log"
    },
    {
      "event_id": "E0009",
      "step_id": "S2_T1.2_finish",
      "seq": 8,
      "task_id": "T1.2",
      "action": "finish",
      "attempt": 1,
      "started_on": "2026-05-15T18:42:21Z",
      "completed_on": "2026-05-15T18:42:25Z",
      "outcome": "applied",
      "state_before": {
        "task_status": "review_ended"
      },
      "state_after": {
        "task_status": "completed"
      },
      "stdout_path": "/Users/darkbit1001/workspace/waveplan-mcp/docs/impl/raft-cli-split/logs/S2_T1.2_finish.1.stdout.log",
      "stderr_path": "/Users/darkbit1001/workspace/waveplan-mcp/docs/impl/raft-cli-split/logs/S2_T1.2_finish.1.stderr.log"
    },
    {
      "event_id": "E0010",
      "step_id": "S3_T1.3_implement",
      "seq": 9,
      "task_id": "T1.3",
      "action": "implement",
      "attempt": 1,
      "started_on": "2026-05-15T18:42:25Z",
      "completed_on": "2026-05-15T18:51:32Z",
      "outcome": "applied",
      "state_before": {
        "task_status": "available"
      },
      "state_after": {
        "task_status": "taken"
      },
      "stdout_path": "/Users/darkbit1001/workspace/waveplan-mcp/docs/impl/raft-cli-split/logs/S3_T1.3_implement.1.stdout.log",
      "stderr_path": "/Users/darkbit1001/workspace/waveplan-mcp/docs/impl/raft-cli-split/logs/S3_T1.3_implement.1.stderr.log"
    },
    {
      "event_id": "E0011",
      "step_id": "S3_T1.3_review",
      "seq": 10,
      "task_id": "T1.3",
      "action": "review",
      "attempt": 1,
      "started_on": "2026-05-15T18:51:32Z",
      "completed_on": "2026-05-15T18:54:17Z",
      "outcome": "applied",
      "state_before": {
        "task_status": "taken"
      },
      "state_after": {
        "task_status": "review_taken"
      },
      "stdout_path": "/Users/darkbit1001/workspace/waveplan-mcp/docs/impl/raft-cli-split/logs/S3_T1.3_review.1.stdout.log",
      "stderr_path": "/Users/darkbit1001/workspace/waveplan-mcp/docs/impl/raft-cli-split/logs/S3_T1.3_review.1.stderr.log"
    }
  ]
}
